{
  "layout_version": "QR_SENSOR_v4",
  "qr_version": 13,
  "matrix_size": 69,
  "ecc_level": "H",
  "module_density": "medium",
  "sensor_modules": [
    [
      12,
      46
    ],
    [
      13,
      15
    ],
    [
      13,
      19
    ],
    [
      13,
      24
    ],
    [
      14,
      29
    ],
    [
      14,
      35
    ],
    [
      14,
      38
    ],
    [
      14,
      43
    ],
    [
      14,
      49
    ],
    [
      14,
      53
    ],
    [
      15,
      46
    ],
    [
      16,
      18
    ],
    [
      16,
      22
    ],
    [
      16,
      58
    ],
    [
      16,
      61
    ],
    [
      17,
      12
    ],
    [
      17,
      15
    ],
    [
      17,
      27
    ],
    [
      17,
      30
    ],
    [
      17,
      34
    ],
    [
      17,
      37
    ],
    [
      17,
      42
    ],
    [
      17,
      51
    ],
    [
      17,
      55
    ],
    [
      18,
      48
    ],
    [
      19,
      20
    ],
    [
      19,
      58
    ],
    [
      20,
      25
    ],
    [
      20,
      29
    ],
    [
      20,
      32
    ],
    [
      20,
      35
    ],
    [
      20,
      38
    ],
    [
      20,
      43
    ],
    [
      20,
      51
    ],
    [
      20,
      55
    ],
    [
      21,
      17
    ],
    [
      21,
      48
    ],
    [
      21,
      61
    ],
    [
      22,
      14
    ],
    [
      22,
      58
    ],
    [
      23,
      28
    ],
    [
      23,
      31
    ],
    [
      23,
      34
    ],
    [
      23,
      37
    ],
    [
      23,
      40
    ],
    [
      23,
      51
    ],
    [
      23,
      55
    ],
    [
      24,
      20
    ],
    [
      24,
      23
    ],
    [
      24,
      45
    ],
    [
      25,
      13
    ],
    [
      25,
      17
    ],
    [
      25,
      60
    ],
    [
      26,
      27
    ],
    [
      26,
      35
    ],
    [
      26,
      48
    ],
    [
      26,
      57
    ],
    [
      27,
      23
    ],
    [
      27,
      42
    ],
    [
      27,
      45
    ],
    [
      27,
      54
    ],
    [
      28,
      17
    ],
    [
      28,
      20
    ],
    [
      28,
      51
    ],
    [
      30,
      23
    ],
    [
      30,
      48
    ],
    [
      31,
      17
    ],
    [
      32,
      14
    ],
    [
      32,
      45
    ],
    [
      33,
      20
    ],
    [
      33,
      23
    ],
    [
      33,
      42
    ],
    [
      33,
      51
    ],
    [
      34,
      48
    ],
    [
      35,
      14
    ],
    [
      35,
      17
    ],
    [
      35,
      54
    ],
    [
      36,
      20
    ],
    [
      36,
      23
    ],
    [
      36,
      26
    ],
    [
      36,
      45
    ],
    [
      36,
      51
    ],
    [
      38,
      17
    ],
    [
      38,
      42
    ],
    [
      38,
      48
    ],
    [
      38,
      54
    ],
    [
      39,
      20
    ],
    [
      39,
      45
    ],
    [
      39,
      51
    ],
    [
      40,
      23
    ],
    [
      40,
      26
    ],
    [
      41,
      17
    ],
    [
      42,
      13
    ],
    [
      42,
      20
    ],
    [
      42,
      31
    ],
    [
      42,
      36
    ],
    [
      42,
      39
    ],
    [
      42,
      42
    ],
    [
      42,
      45
    ],
    [
      42,
      48
    ],
    [
      42,
      51
    ],
    [
      42,
      56
    ],
    [
      43,
      59
    ],
    [
      44,
      23
    ],
    [
      45,
      14
    ],
    [
      45,
      17
    ],
    [
      45,
      20
    ],
    [
      45,
      28
    ],
    [
      45,
      31
    ],
    [
      45,
      34
    ],
    [
      45,
      38
    ],
    [
      45,
      42
    ],
    [
      45,
      45
    ],
    [
      45,
      53
    ],
    [
      45,
      56
    ],
    [
      45,
      62
    ],
    [
      46,
      59
    ],
    [
      47,
      48
    ],
    [
      48,
      17
    ],
    [
      48,
      25
    ],
    [
      48,
      28
    ],
    [
      48,
      32
    ],
    [
      48,
      35
    ],
    [
      48,
      40
    ],
    [
      48,
      45
    ],
    [
      48,
      51
    ],
    [
      48,
      56
    ],
    [
      49,
      20
    ],
    [
      49,
      59
    ],
    [
      49,
      62
    ],
    [
      50,
      14
    ],
    [
      51,
      17
    ],
    [
      51,
      23
    ],
    [
      51,
      27
    ],
    [
      51,
      32
    ],
    [
      51,
      37
    ],
    [
      51,
      40
    ],
    [
      51,
      44
    ],
    [
      51,
      52
    ],
    [
      51,
      56
    ],
    [
      52,
      48
    ],
    [
      52,
      60
    ],
    [
      53,
      14
    ],
    [
      53,
      20
    ],
    [
      54,
      26
    ],
    [
      54,
      32
    ],
    [
      54,
      37
    ],
    [
      54,
      45
    ],
    [
      54,
      51
    ],
    [
      55,
      48
    ],
    [
      56,
      17
    ],
    [
      56,
      20
    ],
    [
      56,
      23
    ],
    [
      56,
      42
    ],
    [
      58,
      26
    ],
    [
      58,
      47
    ],
    [
      58,
      50
    ],
    [
      58,
      53
    ],
    [
      59,
      14
    ],
    [
      59,
      17
    ],
    [
      59,
      20
    ],
    [
      59,
      23
    ],
    [
      59,
      44
    ],
    [
      61,
      48
    ],
    [
      61,
      51
    ],
    [
      61,
      54
    ],
    [
      62,
      15
    ],
    [
      62,
      20
    ],
    [
      62,
      23
    ],
    [
      62,
      43
    ]
  ],
  "reference_regions": {
    "black": [
      [
        3,
        3
      ]
    ],
    "white": [
      [
        1,
        1
      ]
    ]
  },
  "intentional_errors": [],
  "decoder_check": {
    "decoders": [],
    "color_states": [
      "fresh",
      "transition",
      "spoiled"
    ],
    "decode_success_rate": 0.0
  }
}